{
  "$id": "SolverRequest.json",
  "$schema": "https://json-schema.org/draft/2020-12/schema",
  "additionalProperties": false,
  "properties": {
    "candidates": {
      "items": {
        "$ref": "SolverCandidate.json"
      },
      "type": "array"
    },
    "days": {
      "items": {
        "$ref": "SolverDay.json"
      },
      "type": "array"
    },
    "default_mode": {
      "enum": [
        "walk",
        "transit",
        "drive",
        "bike",
        "ferry"
      ],
      "type": "string"
    },
    "time_budget_ms": {
      "exclusiveMinimum": 0,
      "maximum": 9007199254740991,
      "type": "integer"
    },
    "travel_matrix": {
      "items": {
        "$ref": "SolverTravelEdge.json"
      },
      "type": "array"
    },
    "trip_city_id": {
      "format": "uuid",
      "pattern": "^([0-9a-fA-F]{8}-[0-9a-fA-F]{4}-[1-8][0-9a-fA-F]{3}-[89abAB][0-9a-fA-F]{3}-[0-9a-fA-F]{12}|00000000-0000-0000-0000-000000000000|ffffffff-ffff-ffff-ffff-ffffffffffff)$",
      "type": "string"
    }
  },
  "required": [
    "trip_city_id",
    "days",
    "candidates",
    "travel_matrix",
    "default_mode",
    "time_budget_ms"
  ],
  "title": "SolverRequest",
  "type": "object"
}
